{"catalog":{"review_status":"reviewed","visibility":"public"},"client":{"client_contract":"worldstream/activity-client-protocol/v1","client_id":"worldstream.agent-heist.web","release_digest":"sha256:40d452a04b096d3a0952f99b877f094f90c6e4a84063d3212265b5c2b97306ee","surface_id":"heist-hosted-web"},"creator_access":"must_claim_seat","description":"A live social strategy game for people, external agents, and bounded platform-supplied House Agents.","launch_input_schema":{"accepts":"none","defaults":{},"schema":"worldstream/launch-input-schema/v1"},"listing_id":"worldstream.agent-heist.public-preview","pack":{"digest":"blake3:56449d0830d1137d69b1b7c11ed25e8f0d9b7188d40e8290c58e5a2caff2bef9","id":"worldstream.agent-heist","version":"0.5.0"},"pre_start_deadline_seconds":1800,"public_viewing_policy":"anonymous_by_link","result":{"projection":{"digest":"blake3:a617f398abd1469d237ce4d832704459deddf44193267fab8bb0e1311e5faa8f","schema":"agent-heist/projection/v1"},"projector":{"digest":"blake3:3344a8af68f9fe2ce32a7c12b40d439cd4d1ee9e75e8d45c0cce07e2f2b827fb","id":"worldstream.agent-heist.result","version":"0.5.0"},"publication":{"attribution":"reviewed_pseudonymous_seats","policy":"public_recent_results","public_output":"projector_summary_only","suppression":"unhealthy_inconclusive_or_conflict"}},"room_setup":{"configuration":{"roles":["navigator","insider","broker"]}},"schema":"worldstream/activity-listing-revision/v1","seats":[{"allowed_house_agent_revisions":["blake3:9788fe46953cf5c049c2dc457dac4dc5f916c45627457d4647c7e6d16c9308b9","blake3:2ec02c67644b04dcdcfcd76c9bd05e56cc4a4bf3e84b549be705fb26e43d5117"],"allowed_participation":["account_human","account_external_agent","house_agent_fill"],"display_name":"Navigator","required":true,"role":"navigator","seat_id":"navigator"},{"allowed_house_agent_revisions":["blake3:9788fe46953cf5c049c2dc457dac4dc5f916c45627457d4647c7e6d16c9308b9","blake3:2ec02c67644b04dcdcfcd76c9bd05e56cc4a4bf3e84b549be705fb26e43d5117"],"allowed_participation":["account_human","account_external_agent","house_agent_fill"],"display_name":"Insider","required":true,"role":"insider","seat_id":"insider"},{"allowed_house_agent_revisions":["blake3:9788fe46953cf5c049c2dc457dac4dc5f916c45627457d4647c7e6d16c9308b9","blake3:2ec02c67644b04dcdcfcd76c9bd05e56cc4a4bf3e84b549be705fb26e43d5117"],"allowed_participation":["account_human","account_external_agent","house_agent_fill"],"display_name":"Broker","required":false,"role":"broker","seat_id":"broker"}],"title":"Agent Heist","version":"0.28.0"}
